公司名称,统一社会信用代码,所属城市,企业类型标签,上游关键词命中数,下游关键词命中数,中游关键词命中数,建议产业链环节,建议判定依据,经营范围,数据来源
嘉馨（广州）低空经济产业发展有限公司,91440113MAEGPGXA9J,广州市,产业运营类,12,6,6,上游,雷达、导航终端、卫星导航、无线电导航、通信设备、通信终端,智能无人飞行器销售;雷达、无线电导航设备专业修理;业务培训（不含教育培训、职业技能培训等需取得许可的培训）;机械设备研发;人工智能基础资源与技术平台;光学仪器制造;光学仪器销售;智能无人飞行器制造;光电子器件制造;卫星导航服务;导航终端制造;导航终端销售;卫星移动通信终端制造;卫星移动通信终端销售;货物进出口;物联网应用服务;软件开发;电子专用设备销售;机械设备租赁;电子测量仪器制造;人工智能行业应用系统集成服务;5G通信技术服务;电子测量仪器销售;环境监测专用仪器仪表制造;环境监测专用仪器仪表销售;智能车载设备制造;技术进出口;智能车载设备销售;软件销售;外卖递送服务;安全咨询服务;大数据服务;物联网设备销售;卫星导航多模增强应用服务系统集成;网络设备制造;网络设备销售;通信设备销售;电子元器件零售;信息系统运行维护服务;电力电子元器件销售;技术服务、技术开发、技术咨询、技术交流、技术转让、技术推广;计算机软硬件及辅助设备零售;工业互联网数据服务;人工智能硬件销售;机械设备销售;云计算设备制造;云计算设备销售;安全系统监控服务;信息系统集成服务;信息技术咨询服务;雷达及配套设备制造;新材料技术推广服务;计算机及通讯设备租赁;物联网技术研发;国内贸易代理;安防设备销售;安防设备制造;交通安全、管制专用设备制造;计算机软硬件及外围设备制造;通信设备制造;通讯设备修理;电力电子元器件制造;数字视频监控系统制造;地理遥感信息服务;电子产品销售;物联网设备制造;电子元器件制造;智能仪器仪表制造;仪器仪表制造;电子专用设备制造;智能机器人销售;智能机器人的研发;新材料技术研发;数字视频监控系统销售;民用航空器维修;商业非运输、私用大型航空器运营人、航空器代管人运行业务;城市配送运输服务（不含危险货物）;民用航空器零部件设计和生产;民用航空器（发动机、螺旋桨）生产;民用航空器驾驶员培训,天眼查关键词企业
珠海光恒科技有限公司,91440400MA4WAGEK48,珠海市,产业运营类,10,2,3,上游,芯片、集成电路、雷达、无线电导航、通信设备、光电子器件,一般项目：光电子器件制造；光电子器件销售；导航、测绘、气象及海洋专用仪器制造；电子元器件制造；电子专用设备制造；电子专用设备销售；光学仪器制造；光学仪器销售；软件开发；软件销售；工程和技术研究和试验发展；物联网技术研发；物联网设备制造；物联网设备销售；仪器仪表制造；电工仪器仪表销售；海上风电相关系统研发；海上风电相关装备销售；智能车载设备制造；电子测量仪器制造；电子测量仪器销售；雷达及配套设备制造；环境监测专用仪器仪表制造；环境监测专用仪器仪表销售；货物进出口；其他通用仪器制造；导航、测绘、气象及海洋专用仪器销售；机械设备研发；机械设备销售；智能车载设备销售；技术服务、技术开发、技术咨询、技术交流、技术转让、技术推广；机械设备租赁；非居住房地产租赁；物业管理；企业管理；集成电路芯片及产品制造；集成电路芯片及产品销售；集成电路芯片设计及服务；雷达、无线电导航设备专业修理；海洋工程装备研发；海洋工程装备制造；海洋工程装备销售；海洋环境监测与探测装备制造；海洋环境监测与探测装备销售；海洋环境服务；大气污染监测及检测仪器仪表销售；电力电子元器件制造；集成电路销售；电子元器件批发；机械电气设备销售；普通机械设备安装服务；电子、机械设备维护（不含特种设备）；人工智能理论与算法软件开发；计算机软硬件及辅助设备批发；劳务服务（不含劳务派遣）；信息系统运行维护服务；信息系统集成服务；人工智能行业应用系统集成服务；智能机器人的研发；智能机器人销售；海洋能系统与设备制造；海洋能系统与设备销售；人工智能通用应用系统；风电场相关系统研发；智能控制系统集成；虚拟现实设备制造；风电场相关装备销售；通信设备制造；风力发电机组及零部件销售；气象信息服务；气象观测服务；海洋气象服务；电池销售；电池制造；电池零配件生产；通信设备销售；光通信设备制造；光通信设备销售；环境保护专用设备销售；生态环境监测及检测仪器仪表销售；云计算设备制造；云计算设备销售；海洋工程关键配套系统开发；通用设备制造（不含特种设备制造）；实验分析仪器制造；实验分析仪器销售；光伏设备及元器件销售；光伏设备及元器件制造；储能技术服务；机械电气设备制造；专用设备制造（不含许可类专业设备制造）；人工智能硬件销售；人工智能应用软件开发；人工智能基础软件开发。（除依法须经批准的项目外，凭营业执照依法自主开展经营活动）,天眼查关键词企业
中天（深圳）低空经济产业投资有限公司,91440300MAEF6G4246,深圳市,投资发展类,9,8,9,上游,雷达、导航终端、卫星导航、无线电导航、通信设备、通信终端,航空运营支持服务；运输设备租赁服务；民用航空材料销售；智能无人飞行器销售；技术服务、技术开发、技术咨询、技术交流、技术转让、技术推广；租赁服务（不含许可类租赁服务）；航空运输设备销售；航空运输货物打包服务；航空商务服务；航空国际货物运输代理；业务培训（不含教育培训、职业技能培训等需取得许可的培训）；紧急救援服务；从事两国政府间航空运输协定或者有关协议规定的经营性业务活动；科技中介服务；智能无人飞行器制造；5G通信技术服务；雷达及配套设备制造；气象观测服务；智能机器人的研发；交通安全、管制专用设备制造；知识产权服务（专利代理服务除外）；技术进出口；工程技术服务（规划管理、勘察、设计、监理除外）；工程和技术研究和试验发展；导航、测绘、气象及海洋专用仪器销售；物联网技术服务；雷达、无线电导航设备专业修理；移动通信设备制造；移动通信设备销售；光通信设备制造；光通信设备销售；大数据服务；计量技术服务；卫星导航服务；卫星导航多模增强应用服务系统集成；通信设备制造；卫星移动通信终端销售；地理遥感信息服务；信息系统集成服务；卫星技术综合应用系统集成；导航终端制造；导航终端销售；卫星移动通信终端制造；信息技术咨询服务；导航、测绘、气象及海洋专用仪器制造；社会经济咨询服务；量子计算技术服务；人工智能行业应用系统集成服务；人工智能应用软件开发；人工智能基础软件开发；新材料技术推广服务；通讯设备销售；卫星遥感应用系统集成；人工智能基础资源与技术平台；人工智能理论与算法软件开发；人工智能通用应用系统；人工智能公共服务平台技术咨询服务；教育咨询服务（不含涉许可审批的教育培训活动）；数字技术服务；认证咨询；智能控制系统集成；网络与信息安全软件开发。（除依法须经批准的项目外，凭营业执照依法自主开展经营活动） 通用航空服务；飞行训练；民用机场运营；公共航空运输；飞行签派员培训；民用航空器驾驶员培训；商业非运输、私用大型航空器运营人、航空器代管人运行业务；民用航空油料检测服务；民用航空维修人员培训；民用航空油料储运及加注（含抽取）服务；民用航天发射技术服务；测绘服务；民用航空器零部件设计和生产；城市公共交通；认证服务；民用航空器（发动机、螺旋桨）生产；建设工程施工；升放无人驾驶气球、系留气球；电子认证服务；第一类增值电信业务；基础电信业务；第二类增值电信业务；互联网信息服务。（依法须经批准的项目，经相关部门批准后方可开展经营活动，具体经营项目以相关部门批准文件或许可证件为准）,天眼查关键词企业
星耀空科低空科技（深圳）有限公司,91440300MAEB3T1B45,深圳市,产业运营类,8,5,3,上游,导航终端、卫星导航、通信设备、通信终端、电子元器件、电池,技术服务、技术开发、技术咨询、技术交流、技术转让、技术推广；人工智能硬件销售；人工智能应用软件开发；信息技术咨询服务；工程和技术研究和试验发展；节能管理服务；工业互联网数据服务；在线能源监测技术研发；集中式快速充电站；人工智能公共数据平台；新兴能源技术研发；5G通信技术服务；新材料技术推广服务；风力发电技术服务；汽车零部件研发；太阳能发电技术服务；电池销售；新材料技术研发；碳减排、碳转化、碳捕捉、碳封存技术研发；储能技术服务；紧急救援服务；电力电子元器件销售；旅游开发项目策划咨询；政府采购代理服务；招投标代理服务；社会调查（不含涉外调查）；航空运输设备销售；航空运营支持服务；卫星导航服务；卫星技术综合应用系统集成；导航终端制造；卫星移动通信终端销售；有色金属合金销售；移动通信设备销售；导航终端销售；进出口代理；移动终端设备销售；卫星通信服务；地理遥感信息服务；通信设备销售；数字创意产品展览展示服务；项目策划与公关服务；会议及展览服务；环保咨询服务；商业综合体管理服务；供应链管理服务；乡镇经济管理服务；公共事业管理服务；供销合作社管理服务；企业管理。（除依法须经批准的项目外，凭营业执照依法自主开展经营活动）通用航空服务。（依法须经批准的项目，经相关部门批准后方可开展经营活动，具体经营项目以相关部门批准文件或许可证件为准）,天眼查关键词企业
广东横琴东昇防务科技有限公司,91440400MACN71M6XE,珠海市,服务平台类,7,1,1,上游,芯片、集成电路、雷达、卫星导航、无线电导航、通信设备,一般项目：雷达及配套设备制造；通信设备制造；通信设备销售；卫星导航服务；集成电路芯片设计及服务；计算机系统服务；信息系统集成服务；信息技术咨询服务；计算机软硬件及辅助设备零售；技术服务、技术开发、技术咨询、技术交流、技术转让、技术推广；电子元器件零售；电子元器件制造；电子产品销售；雷达、无线电导航设备专业修理。（除依法须经批准的项目外，凭营业执照依法自主开展经营活动）,天眼查关键词企业
深圳联合飞机科技有限公司,914403003116581250,深圳市,产业运营类,7,3,7,上游,集成电路、电子元器件、电池、电机、发动机、螺旋桨,一般经营项目：计算机软件技术开发、技术转让、技术咨询、技术服务；计算机智能控制、计算机系统开发；机械设备租赁（不含行政许可的项目）；电子产品、计算机、软件及辅助设备、通讯设备、机械设备的销售；经营进出口业务；自有物业租赁。（法律、行政法规、国务院决定禁止的项目除外，限制的项目须取得许可后方可经营）；汽车零部件及配件制造；工程和技术研究和试验发展；技术服务、技术开发、技术咨询、技术交流、技术转让、技术推广；智能控制系统集成；信息系统集成服务；机械设备租赁；机械设备销售；电子产品销售；计算机软硬件及辅助设备零售；通讯设备修理；通讯设备销售；计算机及通讯设备租赁；机械设备研发；货物进出口；技术进出口；物业管理；非居住房地产租赁；住房租赁；集成电路设计；智能无人飞行器制造；智能无人飞行器销售；电池制造；电池销售；电池零配件生产；电池零配件销售；物联网设备制造；物联网设备销售；微特电机及组件制造；微特电机及组件销售；发电机及发电机组制造；发电机及发电机组销售；电机及其控制系统研发；电机制造；导航、测绘、气象及海洋专用仪器制造；导航、测绘、气象及海洋专用仪器销售；软件开发；电力电子元器件制造；电力电子元器件销售；智能车载设备制造；智能车载设备销售；农业机械制造；农业机械服务；农业机械销售；智能农机装备销售；智能农业管理；农作物病虫害防治服务；林业有害生物防治服务；智能机器人的研发；智能机器人销售；其他电子器件制造；仪器仪表修理。（除依法须经批准的项目外，凭营业执照依法自主开展经营活动）许可经营项目：无人直升机设计、研发、生产、制造；生产、加工计算机软件；仪器仪表维修。测绘服务；民用航空器（发动机、螺旋桨）生产；民用航空器维修；民用航空器零部件设计和生产；通用航空服务；道路机动车辆生产。（依法须经批准的项目，经相关部门批准后方可开展经营活动，具体经营项目以相关部门批准文件或许可证件为准）,天眼查补录30家
深圳蜚廉低空飞行服务有限公司,91440300MADFFCFB4G,深圳市,产业运营类,7,6,7,上游,雷达、导航终端、卫星导航、无线电导航、通信设备、电池,航空商务服务；航空运营支持服务；航空国际货物运输代理；航空运输设备销售；航空运输货物打包服务；民用航空材料销售；有色金属铸造；轮胎制造；轮胎销售；信息系统集成服务；玻璃制造；国内货物运输代理；旅客票务代理；地理遥感信息服务；导航、测绘、气象及海洋专用仪器制造；导航、测绘、气象及海洋专用仪器销售；卫星通信服务；机械电气设备制造；机械电气设备销售；雷达及配套设备制造；石墨及碳素制品制造；石墨及碳素制品销售；照明器具制造；照明器具销售；高性能密封材料销售；智能无人飞行器制造；功能玻璃和新型光学材料销售；卫星遥感应用系统集成；智能无人飞行器销售；体育用品设备出租；电动机制造；通信设备制造；钟表与计时仪器制造；钟表与计时仪器销售；金属丝绳及其制品制造；金属丝绳及其制品销售；电机制造；金属结构制造；合成纤维销售；轴承销售；合成材料制造（不含危险化学品）；导航终端制造；导航终端销售；合成纤维制造；金属结构销售；合成材料销售；电池制造；电池销售；玻璃纤维及制品制造；玻璃纤维及制品销售；卫星导航服务；玻璃纤维增强塑料制品制造；玻璃纤维增强塑料制品销售；照相机及器材制造；照相机及器材销售；体育用品及器材制造；轴承、齿轮和传动部件制造；轴承、齿轮和传动部件销售；国际货物运输代理；雷达、无线电导航设备专业修理；软件开发；技术服务、技术开发、技术咨询、技术交流、技术转让、技术推广；会议及展览服务；咨询策划服务；社会经济咨询服务；信息咨询服务（不含许可类信息咨询服务）；项目策划与公关服务；农业机械服务；农业园艺服务；农业机械租赁；农业机械制造；农业机械销售；农业科学研究和试验发展；休闲观光活动；工程和技术研究和试验发展。（除依法须经批准的项目外，凭营业执照依法自主开展经营活动）通用航空服务；公共航空运输；民用航空器维修；民用航空油料储运及加注（含抽取）服务。（依法须经批准的项目，经相关部门批准后方可开展经营活动，具体经营项目以相关部门批准文件或许可证件为准）,天眼查关键词企业
